"ttwo; 10036; Communication Services; 5800; Take-Two Interactive Software, Inc. develops, publishes, and markets interactive entertainment solutions for consumers worldwide. The company offers its products under the Rockstar Games and 2K labels, as well as under Private Division and Social Point labels. It develops and publishes action/adventure products under the Grand Theft Auto, Max Payne, Midnight Club, and Red Dead Redemption names; and offers episodes, content, and virtual currency. The company also develops brands in other genres, including the LA Noire, Bully, and Manhunt franchises. In addition, the company publishes various entertainment properties across various platforms and a range of genres, such as shooter, action, role-playing, strategy, sports, and family/casual entertainment under the BioShock, Mafia, Sid Meier's Civilization, XCOM series, and Borderlands. Further, it publishes sports simulation titles comprising NBA 2K series, a basketball video game; the WWE 2K professional wrestling series. It also offers Kerbal Space Program, The Outer Worlds, Ancestors the Humankind Odyssey under Private Division. Additionally, the company offers free-to-play mobile games, such as Dragon City and Monster Legends. Its products are designed for console gaming systems, including Sony's PlayStation 4; Microsoft's Xbox One; the Nintendo Switch; and personal computers comprising smartphones and tablets. The company provides its products through physical retail, digital download, online platforms, and cloud streaming services. Take-Two Interactive Software, Inc. was founded in 1993 and is headquartered in New York, New York.; New York; 646 536 2842; NY; United States; []; http://www.take2games.com; 1; 110 West 44th Street; Electronic Gaming & Multimedia; 176.7; 177.73; 180.14435; None; 0; None; 180.43; None; 1268050; None; 176.7; 179.6063; None; 177.73; None; 1268050; None; None; None; None; None; 0.617551; None; None; 177.68; 2; USD; 42.199577; 1178835; None; None; None; 20749316096; None; None; 1430034; 6.29935; 177.68; 180.4; None; 800; 1178835; 214.91; 29.150486; None; None; 115.49; 180.38; False; None; 800; 180.43; NMS; Take-Two Interactive Software, ; Take-Two Interactive Software, Inc.; America/New_York; EDT; False; -14400000; EQUITY; TTWO; finmb_371281; us_market; None; 5.202; None; 0.14961; 28.421; 0.47853732; None; 6.18; None; 115111000; None; None; 28.809; 3233584; 0.028099999; None; 1585612800; 0.95202005; 492796000; 4.269; 0.001; 0.5722387; 6.253254; 0.01753; 1648684800; 1609372800; 2.37; 1613088000; 109160243; 17134828544; None; 1113264000; 3:2; None; 1222300800; None; 0.114; 1615766400; 1.59; None; 0.0318; 2595410; None; None; None; 180.15; https://logo.clearbit.com/take2games.com"
"hri; 34134; Industrials; 4800; Herc Holdings Inc., through its subsidiaries, operates as an equipment rental supplier primarily in the United States and internationally. It rents aerial, earthmoving, material handling, trucks and trailers, air compressors, compaction, and lighting equipment. The company also provides ProSolutions, an industry specific solution based services, such as power generation, climate control, remediation and restoration, and studio and production equipment; and ProContractor professional grade tools. In addition, it offers various services, including repair, maintenance, equipment management, and safety training; and equipment re-rental and on-site support services, as well as ancillary services, such as equipment transport, rental protection, cleaning, refueling, and labor. Further, the company sells used equipment and contractor supplies, such as construction consumables, tools, small equipment, and safety supplies. It serves non-residential and residential construction, specialty trade, restoration, remediation and environment, and facility maintenance contractors; industrial manufacturing industries, including automotive and aerospace, power, metals and mining, agriculture, pulp, paper and wood, food and beverage, and refineries and petrochemical industries; infrastructure and government sectors; and commercial and retail service, hospitality, healthcare, recreation, entertainment production, and special event management customers. The company sells its products through its sales team and industry catalogs, as well as through participation and sponsorship of industry events, trade shows, and Internet. Herc Holdings Inc. was founded in 1965 and is based in Bonita Springs, Florida.; Bonita Springs; 239 301 1000; FL; United States; []; http://ir.hercrentals.com; 1; 27500 Riverview Center Boulevard; Rental & Leasing Services; Suite 100; 94.6; 94.4; 63.774307; None; 0; None; 98.92; None; 268816; None; 94.6; 88.40829; None; 94.4; None; 268816; None; None; None; None; None; 3.148947; None; None; 94.1; 2; USD; 39.408882; 32786; None; None; None; 2908425984; None; None; 222114; 1.6327548; 94.1; 98.86; None; 1000; 32786; 110.03; 17.384235; None; None; 17.9; 98.5; False; None; 800; 98.92; NYQ; Herc Holdings Inc.; Herc Holdings Inc.; America/New_York; EDT; False; -14400000; EQUITY; HRI; finmb_320141334; us_market; None; 2.693; None; 0.04137; 17.818; 3.6236558; None; 5.69; None; 29402900; None; None; 25.238; 586301; 0.0199; None; 1609372800; 0.95482004; 73700000; 2.51; None; 0.5364487; 3.9193397; 0.013150001; 1672444800; 1609372800; 1.99; 1613088000; 28953368; 4796517888; None; 1467331200; 1:3; None; None; None; 0.011; 1615766400; 0.76; None; 0.0298; 640789; None; None; None; 98.9163; https://logo.clearbit.com/ir.hercrentals.com"
"ads; 43219; Financial Services; 8000; Alliance Data Systems Corporation provides data-driven marketing, loyalty, and payment solutions in the United States, Canada, Europe, the Middle East, Africa, the Asia Pacific, and internationally. It operates through two segments, LoyaltyOne and Card Services. The LoyaltyOne segment offers AIR MILES reward program; short term loyalty program; and loyalty services, which include loyalty consulting, customer analytics, creative services, and mobile solutions. The Card Services segment provides receivable financing services comprising underwriting and risk management, as well as receivables funding services, including comenity card, private label and co-brand credit card programs, and installment lending; processing services, such as new account processing, bill processing, remittance processing, and customer care; marketing services; and digital offerings, including Bread digital payments platform and enhanced digital suite. It serves clients across various end-markets, including financial services, specialty retail, grocery and drugstore chains, petroleum retail, home furnishing and hardware, beauty and jewelry, hospitality and travel, and telecommunications. Alliance Data Systems Corporation was founded in 1996 and is headquartered in Columbus, Ohio.; Columbus; 614-729-4000; OH; United States; []; http://www.alliancedata.com; 1; 3075 Loyalty Circle; Credit Services; 115.2; 115.44; 73.127174; 0.0109375; 0.2045; None; 115.96; None; 669050; None; 115.2; 101.79629; 1.26; 115.44; None; 669050; None; None; None; 0.84; 1613001600; 2.589924; None; None; 111.96; 2; USD; 25.115393; 624589; None; None; None; 5570323456; None; None; 1017177; 1.2319909; 111.96; 121.25; None; 2200; 624589; 121.28; 8.34003; None; None; 25.64; 110.33; False; 0.0075; 800; 115.96; NYQ; Alliance Data Systems Corporati; Alliance Data Systems Corporation; America/New_York; EDT; False; -14400000; EQUITY; ADS; finmb_24604; us_market; None; 4.666; None; 0.047259998; 30.425; 2.9621775; None; 13.44; None; 49695100; None; None; 30.616; 3224129; 0.064899996; None; 1609372800; 0.91569; 295000000; 4.463; 0.21; 0.5722387; 3.6611576; 0.0355; 1672444800; 1609372800; 3.1; 1613088000; 48253398; 21097017344; None; 1149552000; 1:4; None; 1613001600; None; -0.877; 1615766400; -1.65; None; 0.0736; 2483119; None; None; None; 112.09; https://logo.clearbit.com/alliancedata.com"
"nvr; 20190; Consumer Cyclical; 6100; NVR, Inc. operates as a homebuilder in the United States. The company operates in two segments, Homebuilding and Mortgage Banking. It primarily constructs and sells single-family detached homes, townhomes, and condominium buildings under the Ryan Homes, NVHomes, and Heartland Homes names. The company markets its Ryan Homes products to first-time and first-time move-up buyers, and NVHomes and Heartland Homes products to move-up and luxury buyers. It also provides various mortgage-related services to its homebuilding customers, as well as brokers title insurance and performs title searches in connection with mortgage loan closings. The company primarily serves in Maryland, Virginia, West Virginia, Delaware, New Jersey, Eastern Pennsylvania, New York, Ohio, Western Pennsylvania, Indiana, Illinois, North Carolina, South Carolina, Florida, Tennessee, and Washington, D.C. The company was founded in 1980 and is headquartered in Reston, Virginia.; Reston; 703-956-4000; VA; United States; []; http://www.nvrinc.com; 1; Plaza America Tower I; Residential Construction; Suite 500 11700 Plaza America Drive; 4776.41; 4733.5; 4243.548; None; 0; None; 4832.8; None; 22050; None; 4776.41; 4605.46; None; 4733.5; None; 22050; None; None; None; None; None; 1.005958; None; None; 4571.05; 2; USD; 19.924124; 29061; None; None; None; 16877253632; None; None; 24828; 2.2316172; 4571.05; 4757.88; None; 1000; 29061; 4832.8; 12.940642; None; None; 2043.01; 3868.18; False; None; 900; 4832.8; NYQ; NVR, Inc.; NVR, Inc.; America/New_York; EST; False; -18000000; EQUITY; NVR; finmb_182505; us_market; None; 2.085; None; 0.119169995; 13.534; 0.5688914; None; 354.29; None; 3695580; None; None; 839.672; 47003; 0.0128; None; 1609372800; 0.84669; 901248000; 230.11; 0.167; 0.4530841; 5.460156; 0.053969998; 1672444800; 1609372800; 1.78; 1611878400; 3584329; 15768761344; None; None; None; None; 635731200; None; 0.191; 1614297600; 2.79; None; 0.016; 44614; None; None; None; 4584.74; https://logo.clearbit.com/nvrinc.com"
"usfd; 60018; Consumer Defensive; 26000; US Foods Holding Corp., through its subsidiary, US Foods, Inc., markets and distributes fresh, frozen, and dry food and non-food products to foodservice customers in the United States. The company's customers include independently owned single and multi-unit restaurants, regional concepts, national restaurant chains, hospitals, nursing homes, hotels and motels, country clubs, government and military organizations, colleges and universities, and retail locations. As of January 2, 2021, it operated 70 distribution facilities; and 78 cash and carry locations. The company was formerly known as USF Holding Corp. and changed its name to US Foods Holding Corp. in February 2016. US Foods Holding Corp. was incorporated in 2007 and is headquartered in Rosemont, Illinois.; Rosemont; 847 720 8000; IL; United States; []; http://www.usfoods.com; 1; 9399 West Higgins Road; Food Distribution; Suite 100; 36.85; 36.86; 30.575073; None; 0; None; 38.9; None; 2647875; None; 36.85; 36.694; None; 36.86; None; 2647875; None; None; None; None; None; 1.823373; None; None; 35.75; 2; USD; 1593817; None; None; None; 8527017472; None; None; 2055475; 0.3726029; 35.75; 38.54; None; 900; 1593817; 41.23; 16.343222; None; None; 11.56; 38.49; False; None; 800; 38.9; NYQ; US Foods Holding Corp.; US Foods Holding Corp.; America/New_York; EDT; False; -14400000; EQUITY; USFD; finmb_325290136; us_market; None; 0.613; None; -0.00988; 25.788; 1.8367975; None; 2.36; None; 221079008; None; None; 15.973; 5480822; 0.0248; None; 1609545600; 0.92583; -254000000; -1.155; None; 0.652609; 2.4146998; 0.0093; 1672617600; 1609545600; 2.71; 1611878400; 220298342; 14028751872; None; None; None; None; None; None; None; 1614297600; 0.25; None; 0.0249; 3426371; None; None; None; 38.57; https://logo.clearbit.com/usfoods.com"
"urg; 80127; Energy; 18; Ur-Energy Inc. engages in the acquisition, exploration, development, and operation of uranium mineral properties. The company holds interests in 12 projects located in the United States. Its flagship property is the Lost Creek project comprising a total of approximately 1,800 unpatented mining claims and three Wyoming mineral leases covering an area of approximately 36,000 acres located in the Great Divide Basin, Wyoming. The company was incorporated in 2004 and is headquartered in Littleton, Colorado.; Littleton; 720-981-4588; CO; United States; []; http://www.ur-energy.com; 1; 10758 West Centennial Road; 720-981-5643; Uranium; Suite 200; 1.1; 1.14; 0.77666664; None; 0; None; 1.2; None; 2740212; None; 1.1; 1.1754286; None; 1.14; None; 2740212; None; None; None; None; None; 1.358589; None; None; 1.13; 4; USD; 1772645; None; None; None; 228233664; None; None; 5371767; 27.445126; 1.13; 1.18; None; 1200; 1772645; 1.57; -39.666668; None; None; 0.36; 1.17; False; None; 1000; 1.2; ASE; Ur Energy Inc; Ur-Energy Inc.; America/New_York; EDT; False; -14400000; EQUITY; URG; finmb_24905528; us_market; None; 26.061; None; -1.7779; -25.15; 1.9729729; None; -0.03; None; 188307008; None; None; 0.2; 3310928; 0.0175; None; 1609372800; 0.1526; -14785000; -0.09; None; 0.5722387; 5.9500003; 0.02973; 1672444800; 1609372800; 0.6; 1613088000; 167842369; 216719424; None; None; None; None; None; None; None; 1615766400; -0.58; None; 0.018; 2181588; None; None; None; 1.19; https://logo.clearbit.com/ur-energy.com"
"lilak; 80202; Communication Services; 11900; Liberty Latin America Ltd., together with its subsidiaries, provides fixed, mobile, and subsea telecommunications services. The company offers communications and entertainment services, including video, broadband internet, fixed-line telephony, and mobile services to residential and business customers; and business products and services that include enterprise-grade connectivity, data center, hosting, and managed solutions, as well as information technology solutions for small and medium enterprises, international companies, and governmental agencies. It also operates a sub-sea and terrestrial fiber optic cable network that connects approximately 40 markets. The company provides its services in approximately 20 countries in Latin America, the Caribbean, Chile, and Costa Rica under the brands of C&W, VTR, Liberty Puerto Rico, Cabletica, BTC, UTS, Flow, and MÃ³vil. Liberty Latin America Ltd. was incorporated in 2017 and is based in Denver, Colorado.; Denver; 303 925 6000; CO; United States; []; http://www.lla.com; 1; 1550 Wewatta Street; Telecom Services; Suite 710; 14.47; 14.26; 10.915395; None; 0; None; 14.54; None; 949000; None; 14.47; 12.322857; None; 14.26; None; 949000; None; None; None; None; None; 1.435701; None; None; 13.5; 2; USD; 584796; None; None; None; 3150377472; None; None; 839800; 0.83684254; 13.5; 13.63; None; 900; 584796; 14.93; 35.723682; None; None; 7.465; 13.62; False; None; 800; 14.54; NMS; Liberty Latin America Ltd.; Liberty Latin America Ltd.; America/New_York; EDT; False; -14400000; EQUITY; LILAK; finmb_288966653; us_market; None; 3.282; None; -0.18254; 8.944; 0.4021113; None; 0.38; None; 181128992; None; None; 11.698; 6003166; 0.025899999; None; 1609372800; 0.76126; -687200000; -3.514; None; 0.652609; 1.1604548; 0.07176; 1672444800; 1609372800; 6.6; 1611878400; 182573679; 12356687872; None; 1599782400; 1062:1000; None; None; None; None; 1614297600; -0.46; None; 0.0368; 6043561; 232072000; None; None; 13.575; https://logo.clearbit.com/lla.com"
"ue; 10019; Real Estate; 106; Urban Edge Properties is a NYSE listed real estate investment trust focused on managing, acquiring, developing, and redeveloping retail real estate in urban communities, primarily in the New York metropolitan region. Urban Edge owns 78 properties totaling 15.1 million square feet of gross leasable area.; New York; 212-956-2556; NY; United States; []; http://www.uedge.com; 1; 888 Seventh Avenue; REIT—Diversified; 6th Floor; 16.39; 16.61; 13.245073; 0.013422819; 0.2785; None; 17.34; None; 871142; None; 16.39; 16.528856; 0.22; 16.61; None; 871142; None; None; None; 0.6; 1615507200; 1.761646; None; None; 16.73; 2; USD; 21.536524; 280115; None; None; None; 2001024896; None; None; 836730; 6.0619664; 16.73; 17.15; None; 900; 280115; 18.19; 85.5; None; 4.23; 7.45; 17.14; False; 0.0366; 1300; 17.34; NYQ; Urban Edge Properties; Urban Edge Properties; America/New_York; EDT; False; -14400000; EQUITY; UE; finmb_278421761; us_market; None; 9.825; None; 0.28351998; 22.732; 0.77380955; None; 0.2; None; 117019000; None; None; 8.132; 3161869; 0.027; None; 1609372800; 0.96658; 93527000; 0.794; 0.15; 0.652609; 2.1028037; 0.05845; 1672444800; 1609372800; 4.02; 1611878400; 115937757; 3243194624; None; None; None; None; 1615507200; None; 4.617; 1614297600; 41.09; None; 0.0493; 2706644; None; None; None; 17.1; https://logo.clearbit.com/uedge.com"
"fss; 60523; Industrials; 3500; Federal Signal Corporation, together with its subsidiaries, designs, manufactures, and supplies a suite of products and integrated solutions for municipal, governmental, industrial, and commercial customers in the United States, Canada, Europe, and internationally. It operates through two segments, Environmental Solutions Group, and Safety and Security Systems Group. The Environmental Solutions Group segment offers a range of street sweepers, sewer cleaners, industrial vacuum loaders, safe-digging trucks, waterblasting equipment, road-marking and line-removal equipment, dump truck bodies, and trailers under the Elgin, Vactor, Guzzler, TRUVAC, Westech, Jetstream, Mark Rite Lines, Ox Bodies, Crysteel, J-Craft, Duraclass, Rugby, and Travis brand names. It also offers refuse and recycling collection vehicles, camera systems, ice resurfacing equipment, and snow-removal equipment. In addition, this segment engages in the sale of parts, service and repair, equipment rental, and training activities. The Safety and Security Systems Group segment provides systems and products for community alerting, emergency vehicles, first responder interoperable communications, and industrial communications. Its products include vehicle lightbars and sirens, industrial signaling equipment, public warning systems, general alarm systems, and public address systems. This segment sells its products under the Federal Signal, Federal Signal VAMA, and Victor brand names. The company sells its products through wholesaler, distributor, independent manufacturer representative, original equipment manufacturer, and direct sales force, as well as independent foreign distributor. Federal Signal Corporation was founded in 1901 and is headquartered in Oak Brook, Illinois.; Oak Brook; 630 954 2000; IL; United States; []; http://www.federalsignal.com; 1; 1415 West 22nd Street; 630 954 2030; Pollution & Treatment Controls; Suite 1100; 38.78; 38.69; 33.05819; 0.008251676; 0.2051; None; 38.47; None; 193012; None; 38.78; 36.481144; 0.32; 38.69; None; 193012; None; None; None; 0.36; 1616025600; 1.08234; None; None; 37.57; 2; USD; 24.193342; 280824; None; None; None; 2287738624; None; None; 250156; 2.0231152; 37.57; 37.64; None; 2200; 280824; 39.78; 18.707922; None; 1.39; 23.32; 37.6; False; 0.0092; 1100; 38.47; NYQ; Federal Signal Corporation; Federal Signal Corporation; America/New_York; EDT; False; -14400000; EQUITY; FSS; finmb_271329; us_market; None; 2.227; None; 0.08507; 13.983; 0.5071901; None; 2.02; None; 60538200; None; None; 11.605; 1364677; 0.0225; None; 1609372800; 0.9228; 96100000; 1.562; 0.09; 0.652609; 3.2563553; 0.02014; 1672444800; 1609372800; 5.78; 1611878400; 59270489; 2518409728; None; 762566400; 4:3; None; 1616025600; None; -0.124; 1614297600; 1.33; None; 0.0271; 1224649; None; None; None; 37.79; https://logo.clearbit.com/federalsignal.com"
"tk; V6C 2K2; Energy; 5350; Teekay Corporation provides oil and gas transportation services worldwide. It operates liquefied natural gas (LNG) carriers, floating production storage and offloading units, liquefied gas carriers, and conventional tankers. As of December 31, 2019, its fleet consisted of 154 vessels, which included chartered-in vessels. The company serves energy and utility companies, oil traders, large oil and LNG consumers, petroleum product producers, government agencies, and various other entities that depend upon marine transportation. Teekay Corporation was founded in 1973 and is headquartered in Vancouver, Canada.; Vancouver; 604 683 3529; BC; Canada; []; http://www.teekay.com; 1; Bentall 5; 604 844 6600; Oil & Gas Midstream; Suite 2000 550 Burrard Street; 3.4; 3.37; 2.6125548; 0.01617647; 0; None; 3.38; None; 1105200; None; 3.4; 3.3888571; 0.055; 3.37; None; 1105200; None; None; None; None; 1548892800; 1.351029; None; None; 3.27; 4; USD; 667306; None; None; None; 331132000; None; None; 1043031; 0.18237434; 3.27; 3.29; None; 1800; 667306; 4.88; 7.616279; None; None; 1.7; 3.28; False; None; 1200; 3.38; NYQ; Teekay Corporation; Teekay Corporation; America/New_York; EDT; False; -14400000; EQUITY; TK; finmb_329438; us_market; None; 3.197; None; -0.045679998; 7.973; 0.07594931; None; 0.43; None; 101109000; None; None; 4.761; 2846817; 0.028199999; None; 1609372800; 0.27295; -82933000; -0.821; 0.055; 0.5364487; 0.6878807; 0.31586; 1672444800; 1609372800; 2.6; 1613088000; 69172633; 5805230080; None; 1084838400; 2:1; None; 1548892800; None; None; 1615766400; None; None; 0.051999997; 3216160; None; None; None; 3.275; https://logo.clearbit.com/teekay.com"
"vjet; 86316; Technology; 297; voxeljet AG provides three-dimensional (3D) printers and on-demand parts services to industrial and commercial customers in Europe, the Middle East, Africa, the Asia Pacific, and the Americas. It operates in two segments, Systems and Services. The Systems segment develops, manufactures, and sells 3D printers. This segment also offers consumables, including particulate materials and proprietary chemical binding agents, maintenance contracts, and spare parts. The Services segment prints on-demand parts for its customers, as well as creates parts, molds, cores, and models using 3D computer-aided design at its service center; and provides casting services. It serves automotive, aerospace, art and architecture, engineering, and consumer product end markets; foundries and suppliers; and universities and research institutes through its direct sales force and a network of sales agents. The company was formerly known as Voxeljet Technology GmbH and changed its name to voxeljet AG in January 2004. voxeljet AG was founded in 1999 and is headquartered in Friedberg, Germany.; Friedberg; 49 821 7483 100; Germany; []; http://www.voxeljet.com; 1; Paul-Lenz Strasse 1a; 49 821 7843 111; Computer Hardware; 15.01; 14.51; 13.136205; None; 0; None; 16.3; None; 50114; None; 15.01; 18.522858; None; 14.51; None; 50114; None; None; None; None; None; 2.414409; None; None; 13.81; 2; USD; 83259; None; None; None; 92049048; None; None; 165462; 3.4654558; 13.81; 16; None; 2200; 83259; 40; -7.5000005; None; None; 3.75; 15.61; False; None; 900; 16.3; NCM; voxeljet AG; voxeljet AG; America/New_York; EDT; False; -14400000; EQUITY; VJET; finmb_246882377; us_market; None; 3.593; None; -0.69629997; -8.692; 2.2630434; None; -2.08; None; 5900580; None; None; 5.749; 61516; 0.0104; None; 1577750400; 0.13652; -18495112; -3.824; None; 0.60232747; 2.7135155; 0.14995; 1640908800; 1601424000; 0.31; 1613088000; 3650261; 95424736; None; 1597363200; 1:5; None; None; None; None; 1615766400; None; None; None; 57177; None; None; None; 15.6; https://logo.clearbit.com/voxeljet.com"
