"agx; 20850; Industrials; 1154; Argan, Inc., through its subsidiaries, provides engineering, procurement, construction, commissioning, operations management, maintenance, project development, technical, and consulting services to the power generation and renewable energy markets. The company operates through Power Industry Services, Industrial Fabrication and Field Services, and Telecommunications Infrastructure Services segments. The Power Industry Services segment offers engineering, procurement, and construction (EPC) contracting services to the owners of alternative energy facilities, such as biomass plants, wind farms, and solar fields; and design, construction, project management, start-up, and operation services for projects with approximately 15 gigawatts of power-generating capacity. This segment serves independent power project owners, public utilities, power plant equipment suppliers, and energy plant construction companies. The Industrial Fabrication and Field Services segment provides industrial field, and steel pipe and vessel fabrication services for forest products, power, energy, large fertilizer, EPC, mining, and petrochemical companies in southeast region of the United States. The Telecommunications Infrastructure Services segment offers trenchless directional boring and excavation for underground communication and power networks, as well as aerial cabling services; and installs buried cable, high and low voltage electric lines, and private area outdoor lighting systems. It also provides structuring, cabling, terminations, and connectivity that offers the physical transport for high speed data, voice, video, and security networks. This segment serves state and local government agencies, regional communications service providers, electric utilities, and other commercial customers, as well as federal government facilities comprising cleared facilities in the mid-Atlantic region of the United States. Argan, Inc. was founded in 1961 and is headquartered in Rockville, Maryland.; Rockville; 301 315 0027; MD; United States; []; http://www.arganinc.com; 1; One Church Street; 301 315 0064; Engineering & Construction; Suite 201; 46.04; 45.88; 44.47594; 0.021720244; None; None; 49.7899; None; 89657; None; 46.04; 45.131817; 1; 45.88; None; 89657; None; None; None; 1; 1608249600; 0.556563; None; None; 45.7601; 2; USD; 108.237885; 173758; None; None; None; 771006592; None; None; 97704; 2.2481012; 45.7601; 0; None; 800; 173758; 54.5; 20.222221; None; 2.09; 29.91; 0; False; 0.0217; 1000; 49.7899; NYQ; Argan, Inc.; Argan, Inc.; America/New_York; EST; False; -18000000; EQUITY; AGX; finmb_298718; us_market; None; 0.97; None; 0.020739999; 38.295; 0.06826091; None; 2.43; None; 15690000; None; None; 20.964; 218585; 0.0139; None; 1580428800; 0.86968005; 7112000; 0.454; 1.25; 0.1675049; 2.3440182; 0.04991; 1643587200; 1604102400; 2.61; 1609372800; 14953011; 332782080; None; 1002585600; 1:15; None; 1608249600; None; None; 1611878400; 3.43; None; 0.0165; 257237; None; None; None; 49.14; https://logo.clearbit.com/arganinc.com"
"metc; 40507; Basic Materials; 349; Ramaco Resources, Inc. produces and sells metallurgical coal. The company's development portfolio includes the Elk Creek project consisting of approximately 20,166 acres of controlled mineral and 25 seams located in southern West Virginia; the Berwind property comprising approximately 31,200 acres of controlled mineral and an area of Squire Jim seam coal deposits, which is situated on the border of West Virginia and Virginia; the Knox Creek property consisting of approximately 62,100 acres of controlled mineral that is located in Virginia; and the RAM Mine property comprising approximately 1,570 acres of controlled mineral, which is situated in southwestern Pennsylvania. The company serves blast furnace steel mills and coke plants in the United States, as well as international metallurgical coal consumers. The company was founded in 2015 and is headquartered in Lexington, Kentucky.; Lexington; 859-244-7455; KY; United States; []; http://www.ramacoresources.com; 1; 250 West Main Street; Coking Coal; Suite 1800; 4.21; 4.21; 3.4718978; None; 0; None; 4.46; None; 70083; None; 4.21; 4.462059; None; 4.21; None; 70083; None; None; None; None; None; 1.134527; None; None; 4.2; 4; USD; 25473; None; None; None; 190162352; None; None; 128170; 1.1257871; 4.2; 4.46; None; 900; 25473; 5.35; 4.694737; None; None; 1.75; 4.37; False; None; 900; 4.46; NMS; Ramaco Resources, Inc.; Ramaco Resources, Inc.; America/New_York; EDT; False; -14400000; EQUITY; METC; finmb_384479410; us_market; None; 1.135; None; -0.02905; 80.269; 0.806867; None; 0.95; None; 42637300; None; None; 3.959; 70906; 0.0017; None; 1609372800; 0.65062; -4907000; -0.12; None; 0.5131594; 1.1265471; 0.15021; 1672444800; 1609372800; 0.39; 1613088000; 8464784; 191763040; None; None; None; None; None; None; None; 1615766400; 4.94; None; 0.0070999996; 171144; None; None; None; 4.46; https://logo.clearbit.com/ramacoresources.com"
"pm; 10017-5592; Consumer Defensive; 71000; Philip Morris International Inc., through its subsidiaries, manufactures and sells cigarettes, other nicotine-containing products, smoke-free products, and related electronic devices and accessories. The company offers IQOS smoke-free products, including heated tobacco and nicotine-containing vapor products under the HEETS, HEETS Creations, HEETS Dimensions, HEETS Marlboro, HEETS FROM MARLBORO, Marlboro Dimensions, Marlboro HeatSticks, and Parliament HeatSticks brands, as well as under the Fiit and Miix licensed brands. It also sells its products under the Marlboro, Parliament, Bond Street, Chesterfield, L&M, Lark, and Philip Morris brands. In addition, the company owns various cigarette brands, such as Dji Sam Soe, Sampoerna A, and Sampoerna U in Indonesia; and Fortune and Jackpot in the Philippines. It markets and sells its products in the European Union, Eastern Europe, the Middle East, Africa, South and Southeast Asia, East Asia, Australia, Latin America, and Canada. Philip Morris International Inc. was incorporated in 1987 and is headquartered in New York, New York.; New York; 917 663 2000; NY; United States; []; http://www.pmi.com; 1; 120 Park Avenue; Tobacco; 89.35; 88.89; 80.95333; 0.053049803; 0.9186; None; 89.2058; None; 4519012; None; 89.35; 87.23286; 4.74; 88.89; None; 4519012; None; None; None; 4.8; 1616112000; 0.846153; None; None; 88.56; 2; USD; 17.197674; 4915985; None; None; None; 138302177280; None; None; 4851013; 4.819899; 88.56; 89.24; None; 1800; 4915985; 91.25; 13.548091; None; 5.05; 66.85; 88.51; False; 0.0541; 800; 89.2058; NYQ; Philip Morris International Inc; Philip Morris International Inc.; America/New_York; EDT; False; -14400000; EQUITY; PM; finmb_6569181; us_market; None; 5.754; None; 0.28076; 13; 0.1937046; None; 6.55; None; 1558509952; None; None; -8.069; 8446350; 0.0054; None; 1609372800; 0.75478995; 8035999744; 5.16; 1.2; 0.5722387; None; 0.0019400001; 1672444800; 1609372800; 1.91; 1613088000; 1554041036; 165107269632; None; None; None; None; 1616112000; None; 0.223; 1615766400; 1.32; None; 0.0054; 10004732; None; None; None; 88.74; https://logo.clearbit.com/pmi.com"
"wm; 77002; Industrials; 48250; Waste Management, Inc., through its subsidiaries, provides waste management environmental services to residential, commercial, industrial, and municipal customers in North America. It offers collection services, including picking up and transporting waste and recyclable materials from where it was generated to a transfer station, material recovery facility (MRF), or disposal site; and owns, develops, and operates landfill gas-to-energy facilities in the United States, as well as owns and operates transfer stations. As of December 31, 2020, the company owned or operated 263 solid waste landfills; 5 secure hazardous waste landfills; 103 MRFs; and 348 transfer stations. It also provides materials processing and commodities recycling services; recycling brokerage services, such as managing the marketing of recyclable materials for third parties; and other strategic business solutions. In addition, the company offers construction and remediation services; services related with the disposal of fly ash, and residue generated from the combustion of coal and other fuel stocks; in-plant services comprising full-service waste management solutions and consulting services; and specialized disposal services for oil and gas exploration and production operations. The company was formerly known as USA Waste Services, Inc. and changed its name to Waste Management, Inc. in 1998. Waste Management, Inc. was incorporated in 1987 and is based in Houston, Texas.; Houston; 713-512-6200; TX; United States; []; http://www.wm.com; 1; 800 Capitol Street; Waste Management; 127.43; 127.34; 116.15203; 0.017107433; 0.6193; None; 129.97; None; 2439928; None; 127.43; 117.37559; 2.18; 127.34; None; 2439928; None; None; None; 2.3; 1615420800; 0.761646; None; None; 127.11; 2; USD; 36.875; 2239035; None; None; None; 54925258752; None; None; 2072864; 3.6092298; 127.11; 130; None; 800; 2239035; 129.97; 24.865902; None; 2.06; 86.9; 129.4; False; 0.0177; 800; 129.97; NYQ; Waste Management, Inc.; Waste Management, Inc.; America/New_York; EDT; False; -14400000; EQUITY; WM; finmb_190694; us_market; None; 4.514; None; 0.0983; 15.981; 0.37209308; None; 5.22; None; 423152992; None; None; 17.625; 4411305; 0.0104; None; 1609372800; 0.79221; 1496000000; 3.52; 0.575; 0.5131594; 7.364539; 0.0015; 1672444800; 1609372800; 1.65; 1613088000; 422167002; 68700254208; None; None; None; None; 1615420800; None; -0.02; 1615766400; 2.31; None; 0.0104; 3599765; None; None; None; 129.8; https://logo.clearbit.com/wm.com"
"loco; 92626; Consumer Cyclical; 5005; El Pollo Loco Holdings, Inc., through its subsidiary El Pollo Loco, Inc., develops, franchises, licenses, and operates quick-service restaurants under the El Pollo Loco name. It offers fire-grilling citrus-marinated chicken in various entrees, including specialty chicken burritos, chicken quesadillas, chicken tostada salads, and chicken tortilla soup, as well as provides 500 calorie entrees, and Pollo Bowl and Pollo salad products. As of December 31, 2020, the company operated approximately 475 company-owned and franchised restaurants in Arizona, California, Nevada, Texas, Utah, and Louisiana. It also licenses 1 restaurant in the Philippines. The company was formerly known as Chicken Acquisition Corp. and changed its name to El Pollo Loco Holdings, Inc. in April 2014. El Pollo Loco Holdings, Inc. was founded in 1980 and is headquartered in Costa Mesa, California.; Costa Mesa; 714 599 5000; CA; United States; []; http://www.elpolloloco.com; 1; 3535 Harbor Boulevard; Restaurants; Suite 100; 19.6; 19.7; 17.416935; None; 0; None; 20.85; None; 249928; None; 19.6; 19.434092; None; 19.7; None; 249928; None; None; None; None; None; 1.573639; None; None; 19.7; 2; USD; 32.75157; 395761; None; None; None; 759184768; None; None; 253475; 1.793525; 19.7; 22; None; 1400; 395761; 21.96; 26.0375; None; None; 6.149; 20; False; None; 800; 20.85; NMS; El Pollo Loco Holdings, Inc.; El Pollo Loco Holdings, Inc.; America/New_York; EST; False; -18000000; EQUITY; LOCO; finmb_21919911; us_market; None; 2.301; None; 0.053189997; 16.893; 0.4505571; None; 0.8; None; 36446700; None; None; 7.439; 2149490; 0.059; None; 1577232000; 0.98836; 22517000; 0.636; None; 0.15735698; 2.8001075; 0.01344; 1640390400; 1600819200; 8.61; 1607990400; 19186291; 974026048; None; None; None; None; None; None; 0.55; 1610668800; 1.76; None; 0.1107; 2180838; None; None; None; 20.83; https://logo.clearbit.com/elpolloloco.com"
"audc; 7019900; Technology; AudioCodes Ltd. designs, develops, and sells voice over IP (VoIP), converged VoIP, and data networking solutions, products, and applications for enterprise unified communications, contact centers, service provider business services, mobile VoIP, and cloud virtualized data centers. The company's products include IP phones, session border controllers (SBC), media gateways, multi-service business routers, managed IP phones, residential gateways, media servers, mobile communications solutions, value added applications, life cycle management solutions, professional services, and survivable branch appliances; device manager; CloudBond 365, an adaptable solution for the data center, customer premises or the branch; CloudBond 365 CCE appliances; User Management Pack 365, a software management application; and VoIP management and routing, a suite of lifecycle applications for large scale cloud or premises-based unified communications deployments. It also provides VocaNOM call routing products; SmartTAP call recording products; Auto Attendant, a tool for managing inbound calls and delivery services; signal processor chips; communications boards; and voice and data logging hardware integration board products. In addition, the company offers planning, implementation, operations, and support services, as well as consulting and training services. It primarily markets and sells its products through a direct sales force and sales representatives to original equipment manufacturers, system integrators and distributors, and network equipment providers in the telecommunication and networking industries. The company operates in the Americas, Europe, the Far East, and Israel. AudioCodes Ltd. was incorporated in 1992 and is headquartered in Lod, Israel.; Lod; 972 3 976 4000; Israel; []; http://www.audiocodes.com; 1; 1 Hayarden Street; 972 3 976 4040; Communication Equipment; Airport City; 26.71; 26.7; 29.68073; 0.011231749; 0.32529998; None; 27.34; None; 184971; None; 26.71; 29.106; 0.3; 26.7; None; 184971; None; None; None; 0.32; 1613520000; 0.561755; None; None; 26.62; 2; USD; 32.506023; 108571; None; None; None; 907075648; None; None; 261850; 4.1086164; 26.62; 27.06; None; 1000; 108571; 44.94; 16.552147; None; None; 21.33; 27.06; False; 0.012; 2200; 27.34; NMS; AudioCodes Ltd.; AudioCodes Ltd.; America/New_York; EDT; False; -14400000; EQUITY; AUDC; finmb_25238; us_market; None; 3.545; None; 0.12342; 19.266; 0.14931154; None; 1.63; None; 33017800; None; None; 6.377; 753795; 0.0228; None; 1609372800; 0.34559; 27248000; 0.83; 0.16; 0.60232747; 4.2308297; 0.25238; 1672444800; 1609372800; 3.43; 1613088000; 25543072; 782560000; None; 971136000; 2:1; None; 1613606400; None; None; 1615766400; 1.76; None; 0.0286; 307188; None; None; None; 26.98; https://logo.clearbit.com/audiocodes.com"
"salt; 98000; Industrials; Scorpio Bulkers Inc., a shipping company, owns and operates dry bulk carriers worldwide. Its vessels transport a range of bulk commodities, including ores, coal, grains, and fertilizers. As of December 31, 2019, the company operated a fleet of 58 vessels that consist of 55 owned and finance leased vessels, including 17 Kamsarmax vessels and 35 Ultramax vessels; five time chartered-in Kamsarmax vessels; and one Ultramax vessel. Scorpio Bulkers Inc. was founded in 2013 and is based in Monaco.; Monaco; 377 9798 5715; Monaco; []; http://www.scorpiobulkers.com; 1; Le Millenium; Marine Shipping; 9, Boulevard Charles III; 19.13; 19.56; 15.06219; 0.010454783; None; None; 20.09; None; 217800; None; 19.13; 17.54; 0.2; 19.56; None; 217800; None; None; None; 0.2; 1613001600; 1.280149; None; None; 18.87; 2; USD; 188121; None; None; None; 225728096; None; None; 201345; 1.3786438; 18.87; 0; None; 2900; 188121; 43; 35.767857; None; None; 10.7; 0; False; 0.0105; 1000; 20.09; NYQ; Scorpio Bulkers Inc.; Scorpio Bulkers Inc.; America/New_York; EST; False; -18000000; EQUITY; SALT; finmb_242372534; us_market; None; 4.207; None; 0; 48.723; -0.4341808; None; 0.56; None; 11269500; None; None; 24.906; 793877; 0.0694; None; 1609372800; 0.30121002; -671982976; -70.854; 0.05; 0.15952432; 0.8042239; 0.44029; 1672444800; 1609372800; 3.61; 1607990400; 5381910; 688898880; None; 1586217600; 1:10; None; 1605139200; None; None; 1610668800; None; None; 0.0959; 833880; None; None; None; 20.03; https://logo.clearbit.com/scorpiobulkers.com"
"gis; 55426; Consumer Defensive; 35000; General Mills, Inc. manufactures and markets branded consumer foods worldwide. The company operates in five segments: North America Retail; Convenience Stores & Foodservice; Europe & Australia; Asia & Latin America; and Pet. It offers ready-to-eat cereals, refrigerated yogurt, soup, meal kits, refrigerated and frozen dough products, dessert and baking mixes, frozen pizza and pizza snacks, snack bars, fruit snacks, nutrition bars, and savory snacks, as well as organic products, including refrigerated yogurt, frozen and shelf-stable vegetables, meal kits, salty snacks, ready-to-eat cereal, and grain snacks. It also supplies branded and unbranded food products to the North American foodservice and commercial baking industries; and manufactures and markets pet food products, including dog and cat food. The company markets its products under the Annie's, Betty Crocker, Bisquick, Blue Buffalo, BLUE Basics, BLUE Freedom, BLUE Wilderness, Bugles, Cascadian Farm, Cheerios, Chex, Cinnamon Toast Crunch, Cocoa Puffs, Cookie Crisp, EPIC, Fiber One, Food Should Taste Good, Fruit by the Foot, Fruit Gushers, Fruit Roll-Ups, Gardetto's, Go-Gurt, Gold Medal, Golden Grahams, HÃ¤agen-Dazs, Helpers, Jus-Rol, Kitano, Kix, LÃ¤rabar, Latina, LibertÃ©, Lucky Charms, Muir Glen, Nature Valley, Oatmeal Crisp, Old El Paso, Oui, Pillsbury, Progresso, Raisin Nut Bran, Total, Totino's, Trix, Wanchai Ferry, Wheaties, Yoki, and Yoplait trademarks. General Mills, Inc. sells its products directly, as well as through broker and distribution arrangements to grocery stores, mass merchandisers, membership stores, natural food chains, e-commerce retailers, commercial and noncommercial foodservice distributors and operators, restaurants, convenience stores, and pet specialty stores, as well as drug, dollar, and discount chains. It operates 500 leased and 358 franchise branded ice cream parlors. General Mills, Inc. was founded in 1866 and is headquartered in Minneapolis, Minnesota.; Minneapolis; 763 764 7600; MN; United States; []; http://www.generalmills.com; 1; Number One General Mills Boulevard; Packaged Foods; 62.49; 62.66; 59.06197; 0.03200512; 0.48540002; None; 62.7; None; 6750766; None; 62.49; 57.843716; 2; 62.66; None; 6750766; None; None; None; 2.04; 1617840000; 0.56013; None; None; 61.67; 2; USD; 15.001214; 4740663; None; None; None; 37690109952; None; None; 4872898; 2.023478; 61.67; 61.7; None; 1300; 4740663; 66.14; 16.7; None; 3.58; 51.51; 61.69; False; 0.0326; 2200; 62.7; NYQ; General Mills, Inc.; General Mills, Inc.; America/New_York; EDT; False; -14400000; EQUITY; GIS; finmb_274715; us_market; None; 2.69; None; 0.13683; 12.022; 0.18419552; None; 3.7; None; 609971008; None; None; 14.531; 27450495; 0.044899996; None; 1590883200; 0.77775; 2548699904; 4.119; 0.51; 0.5364487; 4.2522883; 0.00162; 1653955200; 1614470400; 6.28; 1613088000; 608184053; 50107502592; None; 1276041600; 2:1; None; 1609977600; None; 0.312; 1615766400; 3.87; None; 0.044899996; 23330525; None; None; None; 61.79; https://logo.clearbit.com/generalmills.com"
"fnd; 30339; Consumer Cyclical; 6395; Floor & Decor Holdings, Inc. operates as a multi-channel specialty retailer of hard surface flooring and related accessories. The company's stores offer tile, wood, laminate, vinyl, and natural stone flooring products, as well as decorative and installation accessories. It serves professional installers, commercial businesses, and do it yourself customers. As of December 31, 2020, the company operated 133 warehouse-format stores and two small design studios in 31 states in the United States. Floor & Decor Holdings, Inc. also sells products through its Website, FloorandDecor.com. The company was formerly known as FDO Holdings, Inc. and changed its name to Floor & Decor Holdings, Inc. in April 2017. Floor & Decor Holdings, Inc. was founded in 2000 and is headquartered in Atlanta, Georgia.; Atlanta; 404 471 1634; GA; United States; []; http://www.flooranddecor.com; 1; 2500 Windy Ridge Parkway SE; Home Improvement Retail; 97.68; 97.78; 88.2862; None; 0; None; 99.58; None; 657500; None; 97.68; 96.63765; None; 97.78; None; 657500; None; None; None; None; None; 1.8907; None; None; 91.84; 2; USD; 50.684784; 527508; None; None; None; 9755928576; None; None; 733932; 4.0217566; 91.84; 92.46; None; 1000; 527508; 108.54; 38.3786; None; None; 26.08; 92.3; False; None; 1100; 99.58; NYQ; Floor & Decor Holdings, Inc.; Floor & Decor Holdings, Inc.; America/New_York; EDT; False; -14400000; EQUITY; FND; finmb_270357747; us_market; None; 4.59; None; 0.08038; 36.36; 1.8814158; None; 2.43; None; 104610000; None; None; 9.556; 2143464; 0.020499999; None; 1609372800; 1.06322; 194980992; 1.84; None; 0.5131594; 9.759314; 0.03095; 1672444800; 1609372800; 2.62; 1613088000; 101749027; 11134111744; None; None; None; None; None; None; 0.617; 1615766400; 1.92; None; 0.0273; 1379460; None; None; None; 93.26; https://logo.clearbit.com/flooranddecor.com"
"smpl; 80202; Consumer Defensive; 300; The Simply Good Foods Company operates as a consumer packaged food and beverage company in North America and internationally. The company develops, markets, and sells snacks and meal replacements. It offers primarily nutrition bars, ready-to-drink (RTD) shakes, sweet and salty snacks, protein bars, cookies, pizza, protein chips, recipes, and confectionery products, as well as licensed frozen meals under the Atkins, Atkins Endulge, and Quest brand names. The company distributes its products to various retail channels, such as mass merchandise, grocery and drug channels, club stores, convenience stores, gas stations, and other channels. It also sells its products through e-commerce channels, including atkins.com, questnutrition.com, and amazon.com. The Simply Good Foods Company is headquartered in Denver, Colorado.; Denver; 303 633 2840; CO; United States; []; http://www.thesimplygoodfoodscompany.com; 1; 1225 17th Street; Packaged Foods; Suite 1000; 29.44; 29.5; 25.82529; None; 0; None; 30.84; None; 977137; None; 29.44; 30.364286; None; 29.5; None; 977137; None; None; None; None; None; 0.970208; None; None; 29.26; 2; USD; 50.236546; 425005; None; None; None; 2947715840; None; None; 1037277; 3.2911837; 29.26; 30.73; None; 900; 425005; 35.25; 26.09746; None; None; 15.65; 30.64; False; None; 1300; 30.84; NMS; The Simply Good Foods Company; The Simply Good Foods Company; America/New_York; EDT; False; -14400000; EQUITY; SMPL; finmb_366893563; us_market; None; 3.714; None; 0.06922; 20.393; 0.80613494; None; 1.18; None; 95720600; None; None; 13.127; 3982899; 0.0416; None; 1598659200; 0.90875; 61993000; 0.613; 0.09; 0.53829086; 2.3459282; 0.119049996; 1661731200; 1606521600; 5.09; 1613088000; 93712418; 3325974528; None; None; None; None; 1423526400; None; None; 1615766400; 5.32; None; 0.0513; 3964566; None; None; None; 30.795; https://logo.clearbit.com/thesimplygoodfoodscompany.com"
"nwhm; 92618; Consumer Cyclical; 209; The New Home Company Inc. designs, constructs, and sells single-family detached and attached homes. The company operates through three segments: Arizona Homebuilding, California Homebuilding, and Fee Building. It builds and sells homes in metropolitan areas of California and Arizona, including Southern California, the San Francisco Bay area, metro Sacramento, and the greater Phoenix area; and Denver, Colorado. The company also offers general contracting, construction management and coordination, and escrow coordination services, as well as sales and marketing services to build homes for third-party property owners. The New Home Company Inc. was founded in 2009 and is headquartered in Irvine, California.; Irvine; 949 382 7800; CA; United States; []; http://www.nwhm.com; 1; 15231 Laguna Canyon Road; 949 382 7801; Residential Construction; Suite 250; 5.24; 5.33; 5.230616; None; 0; None; 5.6; None; 36762; None; 5.24; 5.326; None; 5.33; None; 36762; None; None; None; None; None; 2.576923; None; None; 5.37; 2; USD; 29320; None; None; None; 99281840; None; None; 68642; 0.19566356; 5.37; 5.57; None; 1000; 29320; 6.2; 40; None; None; 1.1; 5.53; False; None; 1300; 5.6; NYQ; New Home Company Inc. (The); The New Home Company Inc.; America/New_York; EDT; False; -14400000; EQUITY; NWHM; finmb_115502965; us_market; None; 0.464; None; -0.06468; 52.547; 3.5172415; None; 0.14; None; 18109100; None; None; 10.895; 78448; 0.0043; None; 1609372800; 0.59933996; -32819000; -1.76; None; 0.5722387; 0.5139972; 0.2564; 1672444800; 1609372800; 1.11; 1613088000; 12893996; 235463168; None; None; None; None; None; None; None; 1615766400; None; None; 0.0067000003; 78154; None; None; None; 5.6; https://logo.clearbit.com/nwhm.com"
