"arow; 12801; Financial Services; 517; Arrow Financial Corporation, a bank holding company, provides commercial and consumer banking, and financial products and services. The company's deposit products include demand deposits, interest-bearing checking accounts, savings deposits, time deposits, and other time deposits. Its lending activities comprise commercial loans, such as term loans, time notes, and lines of credit; and commercial real estate loans to finance real estate purchases, refinancing, expansions, and improvements to commercial properties, as well as commercial construction and land development loans to finance projects. The company's lending activities also include consumer installment loans to finance personal expenditures, personal lines of credit, overdraft protection, and automobile loans; and residential real estate loans, fixed home equity loans, and home equity lines of credit for consumers to finance home improvements, debt consolidation, education, and other uses. In addition, it maintains an indirect lending program; and sells residential real estate loan originations into the secondary market. Further, the company provides retirement planning, trust, and estate administration services for individuals; and pension, profit-sharing, and employee benefit plan administration services for corporations. Additionally, it offers insurance agency services comprising group health care policies and life insurance, and property and casualty insurance products; and investment advisory services to its proprietary mutual funds, as well as holds a real estate investment trust. The company operates in the northeastern region of New York State in Warren, Washington, Saratoga, Essex, Clinton, Rensselaer, Albany, and Schenectady counties, as well as surrounding areas. It owns twenty-seven branch banking offices; and leases thirteen branch banking offices, as well as two residential loan origination offices. Arrow Financial Corporation was founded in 1851 and is headquartered in Glens Falls, New York.; Glens Falls; 518-745-1000; NY; United States; []; http://www.arrowfinancial.com; 1; 250 Glen Street; Banks—Regional; 33.31; 33.32; 30.12529; 0.03050135; 0.38529998; None; 33.895; None; 20612; None; 33.31; 33.239716; 1.016; 33.32; 20612; None; None; None; 1.04; 1614556800; 0.66143; None; None; 33.32; 2; USD; 12.821969; 10689; None; None; None; 525656640; None; None; 26826; 4.289639; 33.32; 33.81; None; 1000; 10689; 36.48; 12.583642; None; 3.07; 23.56; 33; False; 0.0312; 800; 33.895; NMS; Arrow Financial Corporation; Arrow Financial Corporation; America/New_York; EDT; False; -14400000; None; EQUITY; AROW; None; None; finmb_251652; 374d6140-d012-32d9-9f1b-8b846992b2a0; us_market; None; 1.875; None; 0.33317003; None; None; None; 2.69; None; 15529000; None; None; 21.552; 105771; 0.0068; None; 1609372800; 0.43105; 40827000; 2.64; None; None; 1.5706198; 0.03461; 1672444800; 1609372800; 3.92; 1613088000; 14993310; 229809376; None; 1568592000; 103:100; None; None; 0.283; 1615766400; 1.82; None; 0.0069999998; 105907; None; None; 33.85; https://logo.clearbit.com/arrowfinancial.com"
"pmt; 91361; Real Estate; 1; PennyMac Mortgage Investment Trust, a specialty finance company, invests primarily in mortgage-related assets in the United States. The company operates through Credit Sensitive Strategies, Interest Rate Sensitive Strategies, and Correspondent Production segments. Its Credit Sensitive Strategies segment invests in credit risk transfer (CRT) agreements, CRT securities, distressed loans, real estate, and non-agency subordinated bonds. The company's Interest Rate Sensitive Strategies segment engages in investing in mortgage servicing rights, excess servicing spreads, and agency and senior non-agency mortgage-backed securities (MBS); and related interest rate hedging activities. Its Correspondent Production segment engages in purchasing, pooling, and reselling newly originated prime credit residential loans directly or in the form of MBS. PNMAC Capital Management, LLC acts as the manager of PennyMac Mortgage Investment Trust. The company qualifies as a real estate investment trust for federal income tax purposes. It generally would not be subject to federal corporate income taxes if it distributes at least 90% of its taxable income to its shareholders. PennyMac Mortgage Investment Trust was founded in 2009 and is headquartered in Westlake Village, California.; Westlake Village; 818-224-7442; CA; United States; []; http://www.pennymacmortgageinvestmenttrust.com; 1; 3043 Townsgate Road; REIT—Mortgage; 19.6; 19.72; 17.636812; 0.077551015; 5.6296; None; 20.01; None; 764212; None; 19.6; 19.205715; 1.52; 19.72; 764212; None; None; None; 1.88; 1618358400; 1.151137; None; None; 19.61; 2; USD; 74.03703; 1053273600; None; None; None; 1957076992; None; None; 885080; 1.3896852; 19.61; 19.95; None; 800; 1053273600; 20.02; 9.254629; None; 10.41; 6; 19.94; False; 0.0959; 1000; 20.01; NYQ; PennyMac Mortgage Investment Tr; PennyMac Mortgage Investment Trust; America/New_York; EDT; False; -14400000; None; EQUITY; PMT; None; None; finmb_59284923; 412b54f6-62be-36d9-8a3c-518fc71e4568; us_market; None; 7.764; None; 0.03719; None; None; None; 2.16; None; 97902800; None; None; 20.408; 2770054; 0.028299998; None; 1609372800; 0.75604; 27148000; 0.27; None; None; 0.97951776; 0.01726; 1672444800; 1609372800; 2.79; 1613088000; 79154400; 10934461440; None; None; None; None; None; 0.414; 1615766400; 2.04; None; 0.0347; 2696520; None; None; 19.99; https://logo.clearbit.com/pennymacmortgageinvestmenttrust.com"
"ivfvc; 99.89; 99.89; 18.3; None; None; None; 99.89; 18.3; 0; 8394122; 99.89; 18.3; None; 99.89; 0; None; 0.036; None; None; None; None; None; None; 99.89; 2; USD; 0; None; None; None; None; None; None; 0; None; 99.89; 100.15; None; 1100; 0; 99.89; None; 1; None; None; 18.3; 99.85; False; None; 900; 99.89; NMS; Ivy NextShares - Ivy Focused Va; Ivy Focused Value NextShares; America/New_York; EDT; False; -14400000; None; ETF; IVFVC; None; None; None; 753426b1-48fa-3ce0-a225-2e5c63d9d5db; us_market; None; None; None; None; None; None; None; None; None; 1476662400; None; None; Ivy Funds; None; None; None; None; None; None; None; None; None; 0.0321; None; None; Exchange Traded Fund; None; None; None; None; None; None; 800-777-6472; The investment seeks to provide capital appreciation with a secondary objective of providing current income. The fund seeks to achieve its objectives by investing primarily in the common stocks of companies that IICO believes offer a high yield and that possess quality, valuation and growth potential characteristics. It seeks to invest in companies that meet all three of these criteria. The fund is non-diversified.; []; 99.89; "
"nxp; 60606; Financial Services; Nuveen Select Tax-Free Income Portfolio is a closed-ended fixed income mutual fund launched by Nuveen Investments Inc. The fund is co-managed by Nuveen Fund Advisors LLC and Nuveen Asset Management, LLC. It invests in the fixed income markets of United States. The fund invests in the investment-grade municipal securities rated Baa and BBB or better. It benchmarks the performance of its portfolio against the Standard & Poor's (S&P) National Municipal Bond Index and Lipper General and Insured Unleveraged Municipal Debt Funds Average. Nuveen Select Tax-Free Income Portfolio was formed on March 19, 1992 and is domiciled in the United States.; Chicago; 312-917-7700; IL; United States; []; http://www.nuveen.com/CEF/Product/Overview.aspx?fundcode=NXP; 1; 333 West Wacker Drive; 312-917-6912; Asset Management; 17.39; 17.66; 17.078478; 0.031397358; 0.9254; None; 17.72; None; 13225; None; 17.39; 17.274286; 0.546; 17.66; 13225; None; None; None; 0.55; 1615507200; 0.179848; None; None; 17.49; 2; USD; 30.342464; 1051260352000; None; None; None; 294802304; None; None; 30359; 29.021057; 17.49; 17.72; None; 1100; 1051260352000; 18.89; None; None; 3.64; 14.21; 17.03; False; 0.0313; 1000; 17.72; NYQ; Nuveen Select Tax Free Income P; Nuveen Select Tax-Free Income Portfolio; America/New_York; EDT; False; -14400000; None; EQUITY; NXP; None; None; finmb_6180082; ab174cf6-54ef-328e-8b7c-7adb1b57e5fa; us_market; None; 28.325; None; 0.95302004; None; None; None; None; None; 16579500; None; None; 16.127; 25322; 0.0015; None; 1585612800; 0.14852999; 9680970; 0.584; None; None; 1.0987784; 0; 1648684800; 1601424000; 0.67; 1613088000; None; 287727072; None; None; None; None; None; -0.264; 1615766400; None; None; 0.0015; 25486; None; None; 17.72; https://logo.clearbit.com/nuveen.com"
"jhme; 18.79; 19.13; 15.0370655; None; None; None; 19.3799; 19.68; 1287; 20249312; 18.79; 18.847057; None; 19.13; 1287; None; 0.026800001; None; None; None; None; None; None; 18.8395; 2; USD; 14956; None; None; None; None; None; None; 7818; None; 18.8395; 19.38; None; 2900; 14956; 20.51; None; 1; None; None; 10; 19.33; False; None; 900; 19.3799; PCX; John Hancock Multifactor Energy; John Hancock Multifactor Energy ETF; America/New_York; EDT; True; -14400000; None; ETF; JHME; None; None; finmb_323642133; 1986210b-fd07-31df-b332-87bb18b96501; us_market; None; None; 2.24; None; None; None; None; None; None; 1459123200; None; None; John Hancock; None; None; None; None; None; None; None; None; None; -0.07; None; None; Exchange Traded Fund; None; None; None; None; None; None; 800-225-6020; The investment seeks to provide investment results that closely correspond, before fees and expenses, to the performance of the John Hancock Dimensional Energy Index (the index).  The fund normally invests at least 80% of its net assets (plus any borrowings for investment purposes) in securities that compose the fund&#39;s index. The index is designed to comprise securities in the energy sector within the U.S. Universe whose market capitalizations are larger than that of the 1001st largest U.S. company at the time of reconstitution. The fund is non-diversified.; []; 19.3881; "
"ccl; 33178-2428; Consumer Cyclical; 70000; Carnival Corporation & plc operates as a leisure travel company. Its ships visit approximately 700 ports under the Carnival Cruise Line, Princess Cruises, Holland America Line, P&O Cruises (Australia), Seabourn, Costa Cruises, AIDA Cruises, P&O Cruises (UK), and Cunard brand names. The company also provides port destinations and other services, as well as owns and operates hotels, lodges, glass-domed railcars, and motor coaches. It sells its cruises primarily through travel agents and tour operators. The company operates in the United States, Canada, Continental Europe, the United Kingdom, Australia, New Zealand, Asia, and internationally. It operates 87 ships with 223,000 lower berths. The company was incorporated in 1972 and is headquartered in Miami, Florida.; Miami; 305 599 2600; FL; United States; []; http://www.carnivalcorp.com; 1; Carnival Place; 305 406 8630; Travel Services; 3655 N.W. 87th Avenue; 26.54; 26.99; 20.114782; 0.018839488; None; None; 27.1; None; 37277825; None; 26.54; 26.074572; 0.5; 26.99; 37277825; None; None; None; None; 1582156800; 2.368364; None; None; 26.5327; 2; USD; 19457789; None; None; None; 31070844928; None; None; 43192283; 5.5543165; 26.5327; 26.85; None; 1400; 19457789; 30.12; 158; None; 4.22; 7.8; 26.87; False; None; 1000; 27.1; NYQ; Carnival Corporation; Carnival Corporation & plc; America/New_York; EDT; True; -14400000; None; EQUITY; CCL; None; None; finmb_258823; 0cb59638-360e-3604-a99a-27513043e7f3; us_market; None; 8.671; None; -1.8298199; -18.126; None; None; 0.17; None; 972936000; None; None; 18.91; 55242178; 0.0478; None; 1606694400; 0.51435; -10236000256; -13.208; None; None; 1.4204125; 0.09155; 1669766400; 1606694400; 0.91; 1613088000; 989781290; 48504016896; None; 897868800; 2:1; None; None; None; 1615766400; 0.09; None; 0.0759; 61461541; None; None; 26.86; https://logo.clearbit.com/carnivalcorp.com"
"elmd; 56071; Healthcare; 120; Electromed, Inc. develops, manufactures, markets, and sells airway clearance therapy and related products that apply high frequency chest wall oscillation (HFCWO) therapy in pulmonary care for patients of all ages in the United States and internationally. The company offers SmartVest airway clearance system; SmartVest SQL System that consists of an inflatable therapy garment, a programmable air pulse generator, and a patented single-hose that delivers air pulses from the generator to the garment; and SmartVest Connect, a wireless technology with personalized HFCWO therapy management portal for patients with compromised pulmonary function. It also provides single patient use SmartVest and SmartVest Wrap products for health care providers in the acute care setting. The company offers its products primarily to home health care market for patients with bronchiectasis, cystic fibrosis, and neuromuscular disease. Electromed, Inc. markets its products primarily to physicians and health care providers, as well as directly to patients. The company was founded in 1992 and is headquartered in New Prague, Minnesota.; New Prague; 952 758 9299; MN; United States; []; http://smartvest.com; 1; 500 Sixth Avenue NW; 866 758 5077; Medical Devices; 10.54; 10.72; 10.123333; None; 0; None; 11.08; None; 57025; None; 10.54; 11.282857; None; 10.72; 57025; None; None; None; None; None; 0.599674; None; None; 10.64; 2; USD; 26.804878; 1055286880; None; None; None; 94899088; None; None; 64275; 2.8651814; 10.64; 11; None; 1100; 1055286880; 19.73; 22.895834; None; None; 8.1; 10.91; False; None; 1200; 11.08; ASE; Electromed, Inc.; Electromed, Inc.; America/New_York; EDT; False; -14400000; None; EQUITY; ELMD; None; None; finmb_104752926; 2845774d-7a90-30da-8919-6b875cc3d5e5; us_market; None; 2.608; None; 0.111719996; 20.52; None; None; 0.48; None; 8635040; None; None; 3.744; 232087; 0.0269; None; 1593475200; 0.47812998; 3700516; 0.41; None; None; 2.9353633; 0.17319; 1656547200; 1609372800; 3.57; 1613088000; 6903459; 86396384; None; None; None; None; None; 0.016; 1615766400; 2.28; None; 0.0324; 252684; None; None; 10.99; https://logo.clearbit.com/smartvest.com"
"wing; 75240; Consumer Cyclical; 238; Wingstop Inc., together with its subsidiaries, franchises and operates restaurants under the Wingstop brand name. Its restaurants offer classic wings, boneless wings, and tenders that are cooked-to-order, and hand-sauced-and-tossed in various flavors. As of December 26, 2020, the company had 1,506 franchised restaurants and 32 company-owned restaurants in 44 states and 10 countries worldwide. Wingstop Inc. was founded in 1994 and is based in Dallas, Texas.; Dallas; 972 686 6500; TX; United States; []; http://www.wingstop.com; 1; 5501 LBJ Freeway; Restaurants; 5th Floor; 127.17; 136.15; 135.47617; 0.003931745; 0.641; None; 138.94; None; 555387; None; 127.17; 133.808; 0.5; 136.15; 555387; None; None; None; 0.56; 1614816000; 1.172806; None; None; 132.51; 2; USD; 174.14104; 1238166; None; None; None; 4032521216; None; None; 536785; 16.207165; 132.51; 135.79; None; 900; 1238166; 172.87; 80.37278; None; None; 74; 135.76; False; 0.0045; 800; 138.94; NMS; Wingstop Inc.; Wingstop Inc.; America/New_York; EDT; False; -14400000; None; EQUITY; WING; None; None; finmb_260824267; aea48c55-cbd6-33a8-8ba3-93631a243cdd; us_market; None; 16.758; None; 0.093669996; 64.53; None; None; 1.69; None; 29688000; None; None; -11.497; 2165380; 0.0729; None; 1608940800; 1.05374; 23306000; 0.78; None; None; None; 0.00592; 1672012800; 1608940800; 2.96; 1613088000; 29505129; 4169615360; None; None; None; None; None; None; 1615766400; 6.72; None; 0.1012; 2011457; None; None; 135.83; https://logo.clearbit.com/wingstop.com"
"kvhi; 02842; Technology; 592; KVH Industries, Inc. designs, develops, manufactures, and markets mobile connectivity products and services for the marine and land mobile markets in the United States and internationally. The company operates through Mobile Connectivity and Inertial Navigation segments. The company offers mobile satellite TV and communications products; two-way satellite communications systems; onboard TracPhone terminals and hub equipment; data management software for maritime communications; and Iridium OpenPort hardware products and services. It also offers airtime plans that enable customers to obtain Internet and voice services; and value-added, and news and radio content services to retail customers. In addition, the company provides navigation, guidance, and stabilization products for the commercial and defense markets comprising precision fiber optic gyro-based systems that enable platform and optical stabilization, navigation, pointing, and guidance; tactical navigation systems for tactical trucks and light armored vehicles; and commercial products, such as navigation and positioning systems for various applications consisting of precision mapping, dynamic surveying, autonomous vehicles, train location control and track geometry measurement systems, industrial robotics, and optical stabilization applications. Further, it offers content, maritime news, sporting content, and television programming delivery services; movie distribution services; and services and support for the mini-VSAT Broadband solution, as well as IoT connectivity service. The company sells its mobile communications products through a network of independent retailers, chain stores, distributors, and service providers; and navigation products directly to the United States and foreign governments, and government contractors, as well as through authorized independent sales representatives. The company also sells and leases its products directly to end users. KVH Industries, Inc. was founded in 1978 and is headquartered in Middletown, Rhode Island.; Middletown; 401 847 3327; RI; United States; []; http://www.kvh.com; 1; 50 Enterprise Center; 401 849 0045; Communication Equipment; 12.68; 12.66; 11.274782; None; 0; None; 12.82; None; 85412; None; 12.68; 13.499143; None; 12.66; 85412; None; None; None; None; None; 0.819609; None; None; 12.5405; 2; USD; 51783; None; None; None; 236085744; None; None; 105177; 1.4873136; 12.5405; 13.48; None; 1800; 51783; 15.29; -1281.0001; None; None; 7.38; 12.4; False; None; 800; 12.82; NMS; KVH Industries, Inc.; KVH Industries, Inc.; America/New_York; EDT; False; -14400000; None; EQUITY; KVHI; None; None; finmb_353460; fe5df8cf-9b5f-3b9b-87b4-2fab8486855b; us_market; None; 1.331; None; -0.13822; -269.404; None; None; -0.01; None; 18429800; None; None; 7.156; 176476; 0.0095999995; None; 1609372800; 0.66278; -21940000; -1.242; None; None; 1.7901062; 0.095019996; 1672444800; 1609372800; 1.7; 1613088000; 13060859; 211212368; None; None; None; None; None; None; 1615766400; -1.42; None; 0.0107; 152870; None; None; 12.81; https://logo.clearbit.com/kvh.com"
"psmt; 92121; Consumer Defensive; 9500; PriceSmart, Inc. owns and operates U.S. style membership shopping warehouse clubs in Central America, the Caribbean, and Colombia. Its warehouse clubs sell brand name and private label consumer products and provide services, such as optical and tires to individuals and businesses. As of February 03, 2021, the company operated 47 warehouse clubs in 12 countries and one U.S. territory. PriceSmart, Inc. was founded in 1994 and is headquartered in San Diego, California.; San Diego; 858 404 8800; CA; United States; []; http://www.pricesmart.com; 1; 9740 Scranton Road; Discount Stores; 96.75; 97.1; 85.69971; 0.007235142; 0.2491; None; 98.294; None; 119950; None; 96.75; 97.184; 0.7; 97.1; 119950; None; None; None; 0.7; 1628726400; 0.912242; None; None; 96.45; 2; USD; 34.80598; 61212; None; None; None; 2981056000; None; None; 134147; 0.87815547; 96.45; 97.88; None; 1100; 61212; 104.9; 25.394804; None; 0.95; 48; 90.06; False; 0.0073; 800; 98.294; NMS; PriceSmart, Inc.; PriceSmart, Inc.; America/New_York; EDT; False; -14400000; None; EQUITY; PSMT; None; None; finmb_377097; eaf203df-106f-366d-95d4-cf4624cb2053; us_market; None; 0.874; None; 0.02537; 14.95; None; None; 3.85; None; 30738300; None; None; 28.565; 651639; 0.0212; None; 1598832000; 0.90266997; 85075000; 2.809; None; None; 3.42272; 0.105950005; 1661904000; 1606694400; 4.61; 1613088000; 27144671; 2966464512; None; None; None; None; None; 0.406; 1615766400; 1.86; None; 0.0509; 754952; None; None; 97.77; https://logo.clearbit.com/pricesmart.com"
"vec; 80919; Industrials; 9200; Vectrus, Inc. provides facility and base operations, supply chain and logistics, information technology mission support, and engineering and digital integration services. It offers facility and base operations services, such as facilities operations and maintenance, base life support, facilities engineering and management, airfield management, civil engineering, public works, transportation operations, and emergency services. The company also offers supply chain and logistics services, including warehouse management and distribution, asset management and logistics, full spectrum aviation maintenance, repair and overhaul, and integrated logistics, equipment maintenance, repair, and services. Additionally, it provides information technology mission support services comprising communications, management and service support, IT service management design and implementation, network and cybersecurity, systems installation and activation, and mission support. Further, the company offers engineering and digital integration solutions, such as perimeter security and intrusion detection, system-of-systems engineering and software development, advanced engineering, integrated electronic security monitoring systems, systematic integrated security protection of physical assets, IP and computer systems, sensor and visualization technologies, energy solutions, and electromagnetic interoperability. Vectrus, Inc. was incorporated in 2014 and is headquartered in Colorado Springs, Colorado.; Colorado Springs; 719 591 3600; CO; United States; []; http://www.vectrus.com; 1; 2424 Garden of the Gods Road; 719 623 7196; Aerospace & Defense; 53.44; 53.42; 48.732826; None; 0; None; 54.25; None; 66437; None; 53.44; 56.204285; None; 53.42; 66437; None; None; None; None; None; 1.577464; None; None; 53.53; 2; USD; 17.085987; 34906; None; None; None; 627426048; None; None; 63860; 0.4495973; 53.53; 62; None; 1000; 34906; 60.32; 11.366527; None; None; 35.96; 25; False; None; 900; 54.25; NYQ; Vectrus, Inc.; Vectrus, Inc.; America/New_York; EDT; False; -14400000; None; EQUITY; VEC; None; None; finmb_262353065; 390853df-ff13-324a-b549-5d195be51bb2; us_market; None; 0.54; None; 0.02648; 13.506; None; None; 4.72; None; 11694800; None; None; 26.232; 322524; 0.0276; None; 1609372800; 0.93016; 36951000; 3.14; None; None; 2.045212; 0.02405; 1672444800; 1609372800; 5.05; 1613088000; 11311233; 753659840; None; 1202860800; 1:1; None; None; 0.577; 1615766400; None; None; 0.028199999; 279068; None; None; 53.65; https://logo.clearbit.com/vectrus.com"
"plw; 35.09; 35.26; 37.796738; None; None; None; 35.39; 34.92; 16900; 103308112; 35.09; 35.833427; None; 35.26; 16900; None; 0.0093; None; None; None; None; None; None; 35.26; 2; USD; 113223; None; None; None; None; None; None; 38406; None; 35.26; 35.41; None; 2200; 113223; 40.5; None; 1; None; None; 34.81; 35.12; False; None; 2200; 35.39; NMS; Invesco 1-30 Laddered Treasury ; Invesco 1-30 Laddered Treasury ETF; America/New_York; EDT; False; -14400000; None; ETF; PLW; None; None; finmb_37982787; 8e1dd0fd-69ba-3e1c-b05f-c7f3a2fe8032; us_market; None; None; 2; None; None; None; None; None; None; 1192060800; None; None; Invesco; None; None; None; None; None; None; None; None; None; 0.0523; None; None; Exchange Traded Fund; None; None; None; None; None; 0.026099999; 800-983-0903; The investment seeks to track the investment results (before fees and expenses) of the Ryan/NASDAQ U.S. 1-30 Year Treasury Laddered Index.  The fund generally will invest at least 80% of its total assets in the components of the index. Strictly in accordance with its guidelines and mandated procedures, Nasdaq, Inc. oversees the index, which seeks to measure the potential returns of a theoretical portfolio of U.S. Treasury securities with a yield curve based upon 30 distinct annual maturities.; []; 35.38; "
