"caty; 90012; Financial Services; 1205; Cathay General Bancorp operates as the holding company for Cathay Bank that offers various commercial banking products and services to individuals, professionals, and small to medium-sized businesses in the United States. The company offers various deposit products, including passbook accounts, checking accounts, money market deposit accounts, certificates of deposit, individual retirement accounts, and public funds deposits. It also provides loan products, such as commercial mortgage loans, commercial loans, small business administration loans, residential mortgage loans, real estate construction loans, and home equity lines of credit, as well as installment loans to individuals for automobile, household, and other consumer expenditures. In addition, the company offers trade financing, letter of credit, wire transfer, forward currency spot and forward contract, traveler's check, safe deposit, night deposit, social security payment deposit, collection, bank-by-mail, drive-up and walk-up window, automatic teller machine, Internet banking, investment, and other customary bank services, as well as securities and insurance products. As of January 27, 2021, it operated 38 branches in California; 10 branches in New York; three branches in Illinois; four branches in Washington; two branches in Texas; and one each branch in Maryland, Massachusetts, Nevada, New Jersey, and Hong Kong, as well as a representative office in Beijing, Taipei, and Shanghai. The company was founded in 1962 and is headquartered in Los Angeles, California.; Los Angeles; 213-625-4700; CA; United States; []; http://www.cathaygeneralbancorp.com; 1; 777 North Broadway; Banks—Regional; 40.83; 41.3; 31.096323; 0.030369826; 0.4321; None; 42.44; None; 512771; None; 40.83; 39.872284; 1.24; 41.3; None; 512771; None; None; None; 1.24; 1614297600; 1.513001; None; None; 41.16; 2; USD; 14.763066; 35798; None; None; None; 3368855552; None; None; 376276; 6.2684546; 41.16; 42.34; None; 800; 35798; 45.19; 12.388888; None; 2.96; 20.12; 42.12; False; 0.0297; 900; 42.44; NMS; Cathay General Bancorp; Cathay General Bancorp; America/New_York; EDT; False; -14400000; EQUITY; CATY; finmb_316405; us_market; None; 4.176; None; 0.42584; None; 0.9810772; None; 3.42; None; 79510400; None; None; 30.414; 1807685; 0.0227; None; 1609372800; 0.72646004; 228860000; 2.87; 0.31; 0.652609; 1.3931084; 0.054390002; 1672444800; 1609372800; 4.99; 1611878400; 75645441; 2244354048; None; 1096416000; 2:1; None; 1614297600; None; 0.052; 1614297600; 1.7; None; 0.0277; 1770938; None; None; None; 42.37; https://logo.clearbit.com/cathaygeneralbancorp.com"
"amcx; 10001; Communication Services; 2002; AMC Networks Inc., an entertainment company, owns and operates a suite of video entertainment products that are delivered to audiences and a platform to distributors and advertisers in the United States and internationally. The company operates in two segments, National Networks; and International and Other. The National Networks segment operates five national programming networks under the AMC, WE tv, BBC AMERICA, IFC, and SundanceTV names. This segment also produces original programming for its programming networks; and licenses, such as programming worldwide, as well as services the national programming networks. The International and Other segment operates a portfolio of channels under the AMCNI name worldwide; subscription streaming business under the Acorn TV, Shudder, Sundance Now, ALLBLK, and AMC+ names; production and comedy venues activities under the Levity name; and film distribution business under the IFC Films name. The company was founded in 1980 and is headquartered in New York, New York.; New York; 212-324-8500; NY; United States; []; http://www.amcnetworks.com; 1; 11 Penn Plaza; Broadcasting; 53.76; 53.55; 39.30657; None; 0; None; 54.785; None; 906771; None; 53.76; 61.842285; None; 53.55; None; 906771; None; None; None; None; None; 1.324485; None; None; 52.39; 2; USD; 11.456897; 645627; None; None; None; 2204003072; None; None; 1300234; 0.7829618; 52.39; 56.7; None; 900; 645627; 83.63; 6.8416986; None; None; 19.62; 48; False; None; 1200; 54.785; NMS; AMC Networks Inc.; AMC Networks Inc.; America/New_York; EDT; False; -14400000; EQUITY; AMCX; finmb_679630; us_market; None; 1.69; None; 0.08525; 5.854; 1.3957219; None; 7.77; None; 29975400; None; None; 14.877; 6285372; 0.1516; None; 1609372800; 1.33113; 239979008; 4.64; None; 0.60232747; 3.573301; 0.07419; 1672444800; 1609372800; 6.17; 1613088000; 28338988; 4758361600; None; None; None; None; None; None; None; 1615766400; -0.76; None; 0.35810003; 8020990; 41459800; None; None; 53.16; https://logo.clearbit.com/amcnetworks.com"
"leds; 350; Technology; 130; SemiLEDs Corporation develops, manufactures, and sells light emitting diode (LED) chips, LED components, and LED modules and systems in the United States, Taiwan, the Netherlands, Germany, Japan, Ireland, and internationally. The company also sells enhanced vertical, LED product series in blue, white, green, and UV; LED chips to packagers or distributors; and lighting products primarily to original design manufacturers of lighting products and the end-users of lighting devices, as well as packages and sells its LED chips into LED components to distributors. Its products are used for general lighting applications, including commercial, industrial, and residential lighting; and specialty industrial applications, such as ultraviolet or UV, curing of polymers, LED light therapy in medical/cosmetic applications, counterfeit detection, LED lighting for horticulture applications, architectural lighting, and entertainment lighting. SemiLEDs Corporation was founded in 2005 and is headquartered in Chunan, Taiwan.; Chu-Nan; 886 3 758 6788; Taiwan; []; http://www.semileds.com; 1; Hsinchu Science Park; Semiconductors; 3rd Floor No. 11 Ke Jung Road Chu-Nan Site; 4.3; 4.46; 3.4857247; None; 0; None; 4.61; None; 306625; None; 4.3; 4.7835293; None; 4.46; None; 306625; None; None; None; None; None; 1.693391; None; None; 4.34; 4; USD; 5974; None; None; None; 18446054; None; None; 540740; 3.531021; 4.34; 4.59; None; 800; 5974; 9.38; None; None; None; 1.03; 4.39; False; None; 1300; 4.61; NCM; SemiLEDS Corporation; SemiLEDs Corporation; America/New_York; EST; False; -18000000; EQUITY; LEDS; finmb_49436098; us_market; None; 4.72; None; -0.17688; -10.648; 1.0772946; None; None; None; 4011320; None; None; 0.451; 32662; 0.0081; None; 1598832000; 0.05978; -924000; -0.23; None; 0.26783347; 10.19623; 0.41167998; 1661904000; 1606694400; 0.03; 1610668800; 2201895; 24659804; None; 1460937600; 1:10; None; None; None; None; 1613088000; None; None; 0.078200005; 16114; None; None; None; 4.5985; https://logo.clearbit.com/semileds.com"
"logi; 1015; Technology; 6600; Logitech International S.A., through its subsidiaries, designs, manufactures, and markets products that helps people connect to digital and cloud experiences. The company offers pointing devices, such as wireless mouse and trackball; corded and cordless keyboards, living room keyboards, and keyboard-and-mouse combinations; PC webcams; and keyboards for tablets and smartphones, as well as other accessories for mobile devices. It also provides keyboards, mice, headsets, and simulation products, such as steering wheels and flight sticks for gamers; video conferencing products, and controllers for video conferencing room solutions; portable wireless Bluetooth and Wi-Fi speakers, PC speakers, PC headsets, in-ear headphones, and wireless audio wearables; home entertainment controllers for smart home devices comprising lighting, thermostats and door locks, and home security cameras. The company sells its products through a network of distributors, retailers, and e-tailers under the Logitech, Logitech G, ASTRO Gaming, Streamlabs, Ultimate Ears, Jaybird, and Blue Microphones brands. Its channel network includes consumer electronics distributors, retailers, mass merchandisers, specialty stores, computer and telecommunications stores, value-added resellers, and online merchants. The company was founded in 1981 and is headquartered in Lausanne, Switzerland.; Lausanne; Switzerland; []; http://www.logitech.com; 1; Daniel Borel Innovation Center; Computer Hardware; EPFL - Quartier de l'Innovation; 104.5; 106.47; 93.41442; 0.007942583; 0.1576; None; 108.12; None; 690000; None; 104.5; 105.43229; 0.83; 106.47; None; 690000; None; None; None; 0.87; 1600387200; 0.630669; None; None; 106.05; 2; USD; 19.711573; 434097; None; None; None; 18370422784; None; None; 961996; 4.1509433; 106.05; 108.03; None; 800; 434097; 120.24; 26.20874; None; 1.74; 42.11; 107.86; False; 0.0083; 900; 108.12; NMS; Logitech International S.A. - R; Logitech International S.A.; America/New_York; EDT; False; -14400000; EQUITY; LOGI; finmb_388005; us_market; None; 3.683; None; 0.21136999; 16.454; 1.44788; None; 4.12; None; 168920992; None; None; 12.447; 13875078; 0.082100004; None; 1585612800; 0.58191; 935430016; 5.478; 0.874; 0.5722387; 8.675183; 0.00801; 1648684800; 1609372800; 12.49; 1613088000; 167544617; 16298692608; None; 1153094400; 2:1; None; 1600387200; None; 2.255; 1615766400; 0.58; None; 0.08270001; 9757377; None; None; None; 107.98; https://logo.clearbit.com/logitech.com"
"bioc; 92121; Healthcare; Biocept, Inc., an early stage molecular oncology diagnostics company, develops and commercializes proprietary circulating tumor cell and circulating tumor DNA assays utilizing a standard blood sample. The company's cancer assays provide information to healthcare providers to identify oncogenic alterations that qualify a subset of cancer patients for targeted therapy at diagnosis, progression, and monitoring in order to identify resistance mechanisms. It offers assays for solid tumor indications, such as breast cancer, non-small cell lung cancer, small cell lung cancer, gastric cancer, colorectal cancer, prostate cancer, melanoma, pancreaticobiliary cancer, and ovarian cancer. The company's Target-Selector molecular technology enables detection of mutations and genome alterations with enhanced sensitivity and specificity, as well as is applicable to nucleic acid from ctDNA. In addition, it offers laboratory services to medical oncologists, surgical oncologists, urologists, pulmonologists, pathologists, and other physicians to determine the treatment plan for their patients, as well as to pharmaceutical and biopharmaceutical companies developing drug candidate therapies to treat cancer. The company sells its cancer diagnostic assays directly to oncologists and other physicians at private and group practices, hospitals, laboratories, and cancer centers in the United States, as well as markets its clinical trial and research services to pharmaceutical and biopharmaceutical companies, and clinical research organizations. Biocept has research collaboration with Protean BioDiagnostics Inc. Biocept, Inc. was founded in 1997 and is headquartered in San Diego, California.; San Diego; 858 320 8200; CA; United States; []; http://biocept.com; 1; 9955 Mesa Rim Road; 858 320 8225; Diagnostics & Research; 5.09; 5.15; 5.292464; None; 0; None; 5.1851; None; 1230725; None; 5.09; 6.15; None; 5.15; None; 1230725; None; None; None; None; None; None; None; None; 4.95; 2; USD; 233246; None; None; None; 67242056; None; None; 596744; 2.448603; 4.95; 4.97; None; 900; 233246; 13; -6.274125; None; None; 2.5; 4.96; False; None; 900; 5.1851; NMS; Biocept, Inc.; Biocept, Inc.; America/New_York; EDT; False; -14400000; EQUITY; BIOC; finmb_1316052; us_market; None; 1.311; None; -0.64843005; -2.51; 0.88518524; None; -0.8; None; 13396700; None; None; 3.21; 574308; 0.0429; None; 1609372800; 0.095699996; -17809678; -1.504; None; 0.5722387; 1.5636449; 0.00017000001; 1672444800; 1609372800; 1.49; 1613088000; 7379484; 36014884; None; 1599523200; 1:10; None; None; None; None; 1615766400; -0.25; None; 0.0429; 376845; None; None; None; 5.0193; https://logo.clearbit.com/biocept.com"
"sprt; 94089; Technology; 1231; Support.com, Inc. provides customer support services, end user software, and cloud-based software primarily in the United States. The company offers turnkey and outsourced support services for service providers, retailers, original equipment manufacturers (OEMs), warranty providers, Internet of Things solution providers, and other technology companies. Its customer support services programs include pre-purchased concierge advice, device set-up and troubleshooting, inter-operability problem resolution, and virus and malware removal, wireless network set-up, and home security and automation system onboarding and support designed for consumer, and small and medium business markets. The company also provides Support.com Cloud, a software-as-a-service solution for companies to optimize support interactions with their customers using their own or third party support personnel, as well as enables companies to resolve complex technology issues for their customers, provide ease of use for customer self-service, and enhance the customer experience. In addition, it offers end-user software products, including SUPERAntiSpyware for malware protection and removal. The company provides its technology support services through partners. Support.com, Inc. was founded in 1997 and is headquartered in Wilmington, Delaware.; Wilmington; 650 556 9440; DE; United States; []; http://www.support.com; 1; 1521 Concord Pike; Software—Application; Suite 301; 4.41; 4.49; 2.2432117; None; 0; None; 4.85; None; 45536114; None; 4.41; 2.8048573; None; 4.49; None; 45536114; None; None; None; None; 1577404800; 0.328277; None; None; 4.42; 4; USD; 153.00002; 1209952; None; None; None; 108277184; None; None; 5368414; 2.3212533; 4.42; 4.63; None; 1800; 1209952; 9.45; None; None; None; 1.02; 4.61; False; None; 1100; 4.85; NCM; Support.com, Inc.; Support.com, Inc.; America/New_York; EDT; False; -14400000; EQUITY; SPRT; finmb_34955; us_market; None; 1.198; None; 0.012519999; 162.857; 3.2403846; None; None; None; 23589800; None; None; 1.753; 2129; 0.0001; None; 1577750400; 0.31425; 584000; 0.03; 1; 0.60232747; 2.6183686; 0.23149; 1640908800; 1601424000; 0.02; 1613088000; 14851646; 55859976; None; 1484870400; 1:3; None; 1577404800; None; None; 1615766400; None; None; 0.0001; 21582; None; None; None; 4.59; https://logo.clearbit.com/support.com"
"expo; 94025; Industrials; 901; Exponent, Inc., together with its subsidiaries, operates as a science and engineering consulting company worldwide. Its services include analysis of product development, product recall, regulatory compliance, and the discovery of potential problems related to products, people, property, and impending litigation. The company operates in two segments, Engineering and Other Scientific, and Environmental and Health. The Engineering and Other Scientific segment provides services in the areas of biomechanics, biomedical engineering, buildings and structures, civil engineering, construction consulting, electrical engineering and computer science, human factors, industrial structures, materials and corrosion engineering, mechanical engineering, polymer science and materials chemistry, statistical and data sciences, thermal sciences, and vehicle analysis. The Environmental and Health segment offers services in the areas of chemical regulation and food safety, ecological and biological sciences, environmental and earth sciences, and health sciences. The company offers approximately 90 different technical disciplines to solve complicated issues facing industry and government. It serves clients in chemical, construction, consumer products, energy, food, beverage and nutrition, government, life sciences, insurance, manufacturing, technology, industrial equipment, transportation, and other sectors of the economy. The company was formerly known as The Failure Group, Inc. and changed its name to Exponent, Inc. in 1998. Exponent, Inc. was founded in 1967 and is headquartered in Menlo Park, California.; Menlo Park; 650 326 9400; CA; United States; []; http://www.exponent.com; 1; 149 Commonwealth Drive; Consulting Services; 87.88; 90.09; 81.45863; 0.008306783; 0.48669997; None; 93.34; None; 258800; None; 87.88; 89.99485; 0.73; 90.09; None; 258800; None; None; None; 0.76; 1606953600; 0.343116; None; None; 87.9; 2; USD; 60.853333; 52281; None; None; None; 4712740864; None; None; 267706; 12.295111; 87.9; 91.86; None; 1000; 52281; 97.84; 48.553192; None; 1.05; 58.03; 91.39; False; 0.0087; 800; 93.34; NMS; Exponent, Inc.; Exponent, Inc.; America/New_York; EST; False; -18000000; EQUITY; EXPO; finmb_270377; us_market; None; 11.231; None; 0.20828; 45.825; 0.121204376; None; 1.88; None; 51629500; None; None; 6.647; 610690; 0.0117999995; None; 1578009600; 0.93386; 79833000; 1.5; 0.19; 0.16348481; 13.7325115; 0.010829999; 1641168000; 1601596800; 2.95; 1607990400; 51029068; 4304903168; None; 1528416000; 2:1; None; 1606953600; None; -0.079; 1610668800; 3.86; None; 0.0161; 743331; None; None; None; 91.28; https://logo.clearbit.com/exponent.com"
"hrc; 60601; Healthcare; 10000; Hill-Rom Holdings, Inc. operates as a medical technology company worldwide. It operates through Patient Support Systems, Front Line Care, and Surgical Solutions segments. The company offers medical surgical beds, intensive care unit beds, and bariatric patient beds, patient mobility solutions, non-invasive therapeutic products and surfaces, and information technologies and software solutions, as well as sells equipment service contracts for its capital equipment. It also provides patient monitoring and diagnostics products, such as patient exam and diagnostics, patient monitoring, diagnostic cardiology, vision screening, and diagnostics products; and respiratory health products comprising non-invasive devices that provide respiratory support and assist patients in the mobilization of retained blockages. In addition, the company offers surgical solutions that include tables, lights, and pendants; and positioning devices for use in shoulder, hip, spinal, and lithotomy surgeries, as well as platform-neutral positioning accessories for operating room tables. It sells and rents products to acute and extended care facilities through direct sales force and distributors; sells and rents products directly to patients in the home; and sells products to primary care facilities through distributors. Hill-Rom Holdings, Inc. was founded in 1915 and is headquartered in Chicago, Illinois.; Chicago; 312 819 7200; IL; United States; []; http://www.hillrom.com; 1; 130 East Randolph Street; Medical Instruments & Supplies; Suite 1000; 97.77; 104; 94.92223; 0.008898435; 0.262; None; 106; None; 525687; None; 97.77; 98.90182; 0.87; 104; None; 525687; None; None; None; 0.88; 1607990400; 0.596584; None; None; 100.3; 2; USD; 30.504519; 246789; None; None; None; 6720001536; None; None; 467240; 2.332524; 100.3; 102.22; None; 1300; 246789; 117.68; 16.575287; None; 0.93; 72.29; 101.89; False; 0.0093; 1100; 106; NYQ; Hill-Rom Holdings Inc; Hill-Rom Holdings, Inc.; America/New_York; EST; False; -18000000; EQUITY; HRC; finmb_20963; us_market; None; 2.791; None; 0.0774; 14.215; -0.096562624; None; 6.11; None; 66354000; None; None; 25.902; 1073967; 0.0162; None; 1601424000; 0.88505995; 223000000; 3.32; 0.22; 0.16348481; 3.9099298; 0.00158; 1664496000; 1601424000; 2.96; 1607990400; 66642536; 8041536512; None; 1207008000; 10000:5366; None; 1607990400; None; 0.52; 1610668800; 3.47; None; 0.020599999; 541796; None; None; None; 101.275; https://logo.clearbit.com/hillrom.com"
"smts; M5J 2S1; Basic Materials; 1445; Sierra Metals Inc. focuses on the production, exploration, and development of precious and base metals in Peru and Mexico. It primarily focuses on exploration of silver, copper, lead, zinc, and gold deposits. The company's flagship property is the 81.84% owned polymetallic Yauricocha Mine covering an area of 18,778 hectares located in the Yauyos province in Peru. It also holds 100% interest in the Bolivar and Cusi Mines in Mexico. The company was formerly known as Dia Bras Exploration Inc. and changed its name to Sierra Metals Inc. in December 2012. Sierra Metals Inc. was incorporated in 1996 and is headquartered in Toronto, Canada.; Toronto; 866-493-9646; ON; Canada; []; http://www.sierrametals.com; 1; 161 Bay Street; Other Industrial Metals & Mining; Suite 4260 PO Box 200; 2.82; 3; 2.3975; 0.0014184398; 0; None; 3; None; 1480840; None; 2.82; 3.3545454; 0.004; 3; None; 1480840; None; None; None; None; 1396915200; 2.093098; None; None; 2.86; 4; USD; 23.6; 586313; None; None; None; 486083296; None; None; 624228; 2.0657673; 2.86; 3.03; None; 1300; 586313; 3.87; 42.142857; None; None; 0.45; 2.9; False; None; 1100; 3; ASE; Sierra Metals Inc.; Sierra Metals Inc.; America/New_York; EST; False; -18000000; EQUITY; SMTS; finmb_3109296; us_market; None; 2.261; None; 0.08648; 6.717; 0.68057215; None; 0.07; None; 162800000; None; None; 1.183; 164900; 0.001; None; 1577750400; 0.63625; 20350000; 0.125; 0.005; 0.1675049; 2.4936602; 0.00837; 1640908800; 1601424000; 0.23; 1609372800; 108505094; 532118752; None; 1291766400; 1:7; None; 1396915200; None; 8.854; 1611878400; None; None; None; 38081; None; None; None; 2.95; https://logo.clearbit.com/sierrametals.com"
"osk; 54902; Industrials; 14400; Oshkosh Corporation designs, manufactures, and markets specialty vehicles and vehicle bodies worldwide. The company's Access Equipment segment provides aerial work platforms and telehandlers for use in various construction, industrial, institutional, and general maintenance applications. This segment also offers rental fleet loans and leases, and floor plan and retail financing through third-party funding arrangements; towing and recovery equipment; carriers and wreckers; equipment installation services; and chassis and service parts sales. Its Defense segment provides heavy, medium, and light tactical wheeled vehicles and related services for the department of defense. The company's Fire & Emergency segment offers custom and commercial firefighting vehicles and equipment; and commercial fire apparatus and emergency vehicles, such as pumpers, aerial platform, ladder and tiller trucks, tankers, rescue vehicles, wild land rough terrain response vehicles, mobile command and control centers, bomb squad vehicles, hazardous materials control vehicles, and other emergency response vehicles. This segment also provides aircraft rescue and firefighting, snow removal, and broadcast vehicles, as well as command trucks, and military simulator shelters and trailers. Its Commercial segment offers front-and rear-discharge concrete mixers for the concrete ready-mix industry; refuse collection vehicles and related components to commercial and municipal waste haulers; and field service vehicles and truck-mounted cranes for the construction, equipment dealer, building supply, utility, tire service, railroad, and mining industries. Oshkosh Corporation provides its products through direct sales representatives, dealers, and distributors. The company was formerly known as Oshkosh Truck Corporation and changed its name to Oshkosh Corporation in February 2008. Oshkosh Corporation was founded in 1917 and is headquartered in Oshkosh, Wisconsin.; Oshkosh; 920 502 3400; WI; United States; []; http://www.oshkoshcorp.com; 1; 1917 Four Wheel Drive; Farm & Heavy Construction Machinery; 118.66; 119.58; 89.70261; 0.010365751; 0.26569998; None; 120.21; None; 468075; None; 118.66; 110.89714; 1.23; 119.58; None; 468075; None; None; None; 1.32; 1613001600; 1.591007; None; None; 118.03; 2; USD; 25.818575; 351433; None; None; None; 8174671360; None; None; 852965; 1.2131833; 118.03; 119.28; None; 1000; 351433; 123.49; 15.981283; None; 1.33; 55.33; 119.37; False; 0.0111; 800; 120.21; NYQ; Oshkosh Corporation (Holding Co; Oshkosh Corporation; America/New_York; EDT; False; -14400000; EQUITY; OSK; finmb_294167; us_market; None; 1.217; None; 0.04724; 14.359; 0.8575454; None; 7.48; None; 68384400; None; None; 42.909; 2015973; 0.0295; None; 1601424000; 0.91139; 318300000; 4.63; 0.33; 0.5722387; 2.7858958; 0.00622; 1664496000; 1609372800; 1.66; 1613088000; 67872872; 8197491200; None; 1125273600; 2:1; None; 1613001600; None; -0.082; 1615766400; 1.15; None; 0.0436; 986627; None; None; None; 119.54; https://logo.clearbit.com/oshkoshcorp.com"
